{
  "page_width": 595.0,
  "page_height": 842.0,
  "footer_top": 795,
  "right_x": 405,
  "name_right": 345,
  "amount_band": [
    225,
    402
  ],
  "depth_step": 30,
  "kan_keys": [
    "決算額",
    "国庫支出金",
    "都支出金",
    "市債",
    "その他",
    "一般財源",
    "執行率"
  ],
  "default_funds": [
    "国庫支出金",
    "都支出金",
    "市債",
    "その他",
    "一般財源"
  ],
  "detail_columns": [
    "款_番号",
    "款_名称",
    "款_決算額",
    "款_国庫支出金",
    "款_都支出金",
    "款_市債",
    "款_その他",
    "款_一般財源",
    "款_執行率",
    "款_物理頁",
    "款_上端",
    "款_下端",
    "款_左端",
    "款_右端",
    "項_番号",
    "項_名称",
    "項_予算現額",
    "項_当年度決算額",
    "項_前年度決算額",
    "項_物理頁",
    "項_上端",
    "項_下端",
    "項_左端",
    "項_右端",
    "目_番号",
    "目_名称",
    "目_予算現額",
    "目_当年度決算額",
    "目_前年度決算額",
    "目_物理頁",
    "目_上端",
    "目_下端",
    "目_左端",
    "目_右端",
    "事業_番号",
    "事業_名称",
    "事業_担当課",
    "事業_予算現額",
    "事業_当年度決算額",
    "事業_前年度決算額",
    "事業_説明",
    "事業_物理頁",
    "事業_上端",
    "事業_下端",
    "内訳_番号",
    "内訳_名称",
    "内訳_金額",
    "内訳_物理頁",
    "内訳_上端",
    "内訳_下端",
    "細目_番号",
    "細目_名称",
    "細目_数量",
    "細目_金額",
    "細目_物理頁",
    "細目_上端",
    "細目_下端",
    "細々目_名称",
    "細々目_数量",
    "細々目_金額",
    "細々目_物理頁",
    "細々目_上端",
    "細々目_下端"
  ],
  "funding_columns": [
    "款_番号",
    "項_番号",
    "目_番号",
    "事業_番号",
    "事業_物理頁",
    "事業_上端",
    "財源_名称",
    "財源_金額",
    "財源_物理頁",
    "財源_上端",
    "財源_下端"
  ],
  "annex_columns": [
    "款_番号",
    "項_番号",
    "目_番号",
    "事業_番号",
    "事業_物理頁",
    "事業_上端",
    "本文",
    "物理頁",
    "上端",
    "下端",
    "左端",
    "右端"
  ]
}
